question,contexts,answer,ground_truth,faithfulness,answer_relevancy,context_precision,context_recall
What are the first-line drug classes recommended for treating hypertension in adults?,"['3.4 Drug classes to be used as first-line agents\nTo develop a recommendation that is practical and implementable by end-users, the evidence-to-decision \nframeworks of PICO questions 4 and 5 (see Annex 4) were used to develop one recommendation. \n4. RECOMMENDATION ON DRUG CLASSES TO BE USED AS FIRST-LINE AGENTS\nFor adults with hypertension requiring pharmacological treatment, WHO recommends the \nuse of drugs from any of the following three classes of pharmacological antihypertensive \nmedications as an initial treatment: \n1. thiazide and thiazide-like agents\n2. angiotensin-converting enzyme inhibitors (ACEis)/angiotensin-receptor blockers (ARBs)\n3. long-acting dihydropyridine calcium channel blockers (CCBs).\nStrong recommendation, high-certainty evidence\nLong-acting antihypertensives are preferred.\nExamples of indications to consider specific agents include diuretics or CCBs in patients over \n65 years or those of African descent, beta-blockers in ischaemic heart disease, ACEis/ARBs in \npatients with severe proteinuria, diabetes mellitus, heart failure or kidney disease.'
 'WHO suggests pharmacological antihypertensive treatment of individuals without \ncardiovascular disease but with high cardiovascular risk, diabetes mellitus, or chronic kidney \ndisease, and systolic blood pressure of 130–139 mmHg.\nConditional recommendation, moderate- to high-certainty evidence \n2. RECOMMENDATION ON LABORATORY TESTING\nWhen starting pharmacological therapy for hypertension, WHO suggests obtaining tests to \nscreen for comorbidities and secondary hypertension, but only when testing does not delay \nor impede starting treatment.\n3. RECOMMENDATION ON CARDIOVASCULAR DISEASE RISK ASSESSMENT \nWHO suggests cardiovascular disease risk assessment at or after the initiation of \npharmacological treatment for hypertension, but only where this is feasible and does not \ndelay treatment.\n4. RECOMMENDATION ON DRUG CLASSES TO BE USED AS FIRST-LINE AGENTS\nFor adults with hypertension requiring pharmacological treatment, WHO recommends the \nuse of drugs from any of the following three classes of pharmacological antihypertensive \nmedications as an initial treatment: \n1. thiazide and thiazide-like agents\n2. angiotensin-converting enzyme inhibitors (ACEis)/angiotensin-receptor blockers (ARBs)\n3. long-acting dihydropyridine calcium channel blockers (CCBs).\nStrong recommendation, high-certainty evidence\n5. RECOMMENDATION ON COMBINATION THERAPY\nFor adults with hypertension requiring pharmacological treatment, WHO suggests'
 'Strong recommendation, high-certainty evidence\n5. RECOMMENDATION ON COMBINATION THERAPY\nFor adults with hypertension requiring pharmacological treatment, WHO suggests \ncombination therapy, preferably with a single-pill combination (to improve adherence and \npersistence), as an initial treatment. Antihypertensive medications used in combination \ntherapy should be chosen from the following three drug classes: diuretics (thiazide or \nthiazide-like), angiotensin-converting enzyme inhibitors (ACEis)/angiotensin-receptor \nblockers (ARBs), and long-acting dihydropyridine calcium channel blockers (CCBs).\n6. RECOMMENDATIONS ON TARGET BLOOD PRESSURE\nWHO recommends a target blood pressure treatment goal of <140/90 mmHg in all patients \nwith hypertension without comorbidities.\nviii'
 'to-decision frameworks of PICO questions 6, 7 and 8 (see Annex 4) were used to develop one \nrecommendation. \n5. RECOMMENDATION ON COMBINATION THERAPY\nFor adults with hypertension requiring pharmacological treatment, WHO suggests \ncombination therapy, preferably with a single-pill combination (to improve adherence and \npersistence), as an initial treatment. Antihypertensive medications used in combination \ntherapy should be chosen from the following three drug classes: diuretics (thiazide or \nthiazide-like), angiotensin-converting enzyme inhibitors (ACEis)/angiotensin-receptor \nblockers (ARBs), and long-acting dihydropyridine calcium channel blockers (CCBs).\nCombination medication therapy may be especially valuable when the baseline BP is \n≥20/10 mmHg higher than the target blood pressure.\nSingle-pill combination therapy improves medication-taking adherence and persistence and BP'
 'The 2021 WHO hypertension guideline aims to provide the most current and relevant evidence-\nbased global public health guidance on the initiation of treatment (with pharmacological agents) for \nhypertension in adults. The recommendations target the general adult, non-pregnant, hypertensive \npopulation. \nAlthough several countries and professional societies have guidelines on the topic of hypertension, \nthese are specific to the population of that particular country or the specific setting or constituency of \nthe professional society. Recent shifts in hypertension management, such as moving away from using \nbeta-blockers as a first-line agent or the increased research and adoption of combination therapies \nand single-pill combinations, are all additional reasons for new guidance. The Guideline for the \npharmacological treatment of hypertension in adults will be the first global guideline in the past two \ndecades on the topic and will have specific relevance to low- and middle-income countries (LMICs). \nThe guideline provides new recommendations on the threshold for the initiation of pharmacological \ntreatment for hypertension, recommendations on intervals for follow up, target blood pressure to be \nachieved for control, and the cadre of health care workers who may initiate treatment. It provides \nthe basis for deciding whether to initiate treatment with monotherapy, dual therapy, or single-pill']"," Les médicaments de la classe suivante sont recommandés comme premiers traitements pour le traitement de l'hypertension chez les adultes :
1. agents thiazide et thiazide-like [4]
2. inhibiteurs de l'enzyme convertissante de l'angiotensine (ACEis) / blocateurs des récepteurs angiotensine (ARBs) [4]
3. calcium channel blockers à long terme dihydropyridine (CCBs) [4]","WHO recommends three first-line drug classes for pharmacological treatment of hypertension in adults: thiazide and thiazide-like diuretics, ACE inhibitors or angiotensin receptor blockers (ARBs), and long-acting dihydropyridine calcium channel blockers (CCBs).",1.0,0.8892101412633955,0.99999999998,1.0
What are the main risk factors for type 2 diabetes?,"['type\u202f2 diabetes, with the highest \nrisk among heavy smokers (22). \nRisk remains elevated for about \n1.\u202fThis includes “all monosaccharides \nand disaccharides added to foods by \nthe manufacturer, cook, or consumer, \nplus sugars naturally present in honey, \nsyrups, and fruit juices”. Source: Joint \nWHO/FAO Expert Consultation, WHO \nTechnical Report Series 916 Diet, \nNutrition, and the Prevention of Chronic \nDiseases. Geneva, WHO, 2003.\nOverweight and \nobesity are the \nstrongest risk factors \nfor type\xa02 diabetes'
 'pancreas seems incapable of renewing beta-cells after the age of 30 years. Many \nmechanisms can lead to a decline in function or the complete destruction of \nbeta-cells. These mechanisms include genetic predisposition and abnormalities, \nepigenetic processes, insulin resistance, auto-immunity, concurrent illnesses, \ninflammation, and environmental factors. \nMost common types of diabetes and their risk factors\nRisk factors for type 2 diabetes\noverweight/obesity\nphysical inactivity\ndiabetes in first degree relatives\nhistory of gestational diabetes \ncardiovascular disease and its risk factors\nethnicity (South Asian, Afro-Caribbean, Hispanic)\nThe most common type of diabetes mellitus is type 2 diabetes (T2DM). The majority \nof people with T2DM are overweight or obese, which either causes or aggravates'
 'availability of essential medicines and basic technologies, and reductions in premature mortality resulting from \nNCDs, taking into account the global NCD targets for 2025 and the NCD-related Sustainable Development \nGoal targets for 2030.\ny Include interventions for the prevention and control of diabetes within existing national programmes for \nnutrition, physical activity and sport, maternal and child health, cardiovascular disease, and communicable \ndiseases such as HIV/AIDS and tuberculosis, especially in primary care.\n3. CREATE, SUSTAIN AND EXPAND HEALTH-PROMOTING ENVIRONMENTS TO REDUCE MODIFIABLE RISK FACTORS\nThe key modifiable risk factors for type 2 diabetes are overweight and obesity, insufficient physical activity \nand unhealthy dietary practices. Smoking also increases the risk of type 2 diabetes, as well as the risk of \ndiabetes-related complications. Reducing these factors will decrease the occurrence of type 2 diabetes and \nreduce complications related to all types of diabetes. It will also lead to reductions in other NCDs such as \ncardiovascular disease.\nPreventing people becoming overweight or obese is a priority for reducing type 2 diabetes. Many of the risks \nstart in the womb, and nutrition and health during the antenatal period are critical. Promotion of breastfeeding, \nand healthier diet and physical activity in childhood and adolescence along with other supportive environments, \ncan contribute to healthier people and reduction in diabetes and NCDs.'
 'The condition is present when \nblood glucose values are above \nnormal but still below those \ndiagnostic of diabetes (3). Women \nwith gestational diabetes are \nat increased risk of some \ncomplications during pregnancy \nand delivery, as are their infants. \nGestational diabetes is diagnosed \nthrough prenatal screening, \nrather than reported symptoms.\nRISK FACTORS FOR DIABETES\nType\u202f1. The exact causes of \ntype\u202f1 diabetes are unknown. It \nis generally agreed that type\u202f1 \ndiabetes is the result of a complex \ninteraction between genes and \nenvironmental factors, though \nno specific environmental risk \nfactors have been shown to cause \na significant number of cases. The \nmajority of type\u202f1 diabetes occurs \nin children and adolescents.\nType\u202f2. The risk of type\u202f2 diabetes \nis determined by an interplay of \ngenetic and metabolic factors. \nEthnicity, family history of \ndiabetes, and previous gestational \ndiabetes combine with older age, \noverweight and obesity, unhealthy \ndiet, physical inactivity and \nsmoking to increase risk.\nExcess body fat, a summary \nmeasure of several aspects of diet \nand physical activity, is the strongest \nrisk factor for type\u202f2 diabetes, both \nin terms of clearest evidence base \nand largest relative risk. Overweight \nand obesity, together with physical \ninactivity, are estimated to cause \na large proportion of the global \ndiabetes burden (4). Higher waist \ncircumference and higher body mass \nindex (BMI) are associated with \nincreased risk of type\u202f2 diabetes,'
 'a large proportion of the global \ndiabetes burden (4). Higher waist \ncircumference and higher body mass \nindex (BMI) are associated with \nincreased risk of type\u202f2 diabetes, \nthough the relationship may \nvary in different populations\xa0 (5). \nPopulations in South-East Asia, \nfor example, develop diabetes at a \nlower level of BMI than populations \nof European origin (6).\nSeveral dietary practices are linked \nto unhealthy body weight and/or \ntype\u202f2 diabetes risk, including \nhigh intake of saturated fatty \nacids, high total fat intake and \ninadequate consumption of dietary \nfibre (7, 8, 9). High intake of sugar-\nsweetened beverages, which \ncontain considerable amounts \nof free sugars,\u20091 increases the \nlikelihood of being overweight \nor obese, particularly among \nchildren (10, 11). Recent evidence \nfurther suggests an association \nbetween high consumption of \nsugar-sweetened beverages and \nincreased risk of type\u202f2 diabetes \n(7, 12, 13, 14).\nEarly childhood nutrition affects \nthe risk of type\u202f2 diabetes later in \nlife. Factors that appear to increase \nrisk include poor fetal growth, \nlow birth weight (particularly if \nfollowed by rapid postnatal catch-\nup growth) and high birth weight \n(15, 16, 17, 18, 19, 20, 21).\nActive (as distinct from passive) \nsmoking increases the risk of \ntype\u202f2 diabetes, with the highest \nrisk among heavy smokers (22). \nRisk remains elevated for about \n1.\u202fThis includes “all monosaccharides \nand disaccharides added to foods by']"," Les principaux facteurs de risque pour le diabète de type 2 sont :
- l'obésité et la surpoids [2]
- l'inactivité physique [3]
- les pratiques alimentaires non saines [4][5]
- le tabagisme, avec un plus grand risque pour les fumeurs lourds [1][22]","Main risk factors for type 2 diabetes include overweight and obesity, physical inactivity, family history of diabetes, history of gestational diabetes, cardiovascular disease, certain ethnic backgrounds (South Asian, African-Caribbean, Hispanic), and smoking.",,0.9139540544811204,0.99999999998,1.0
What is the global action plan on antimicrobial resistance aiming to achieve?,"['and other interventions, and in strengthening health \nsystems to ensure more appropriate use of and access \nto antimicrobial agents.\n3. \n \nThe development of this global action plan on antimicrobial \nresistance1, requested by the Health Assembly in resolution \nWHA67.25 in May 2014, reflects a global consensus that \nantimicrobial resistance poses a profound threat to human \nhealth. It reflects the input received to date from broad \nmultisectoral and Member States’ consultations.\n4. \n \nThe goal of the global action plan is to ensure, for as \nlong as possible, continuity of successful treatment and \nprevention of infectious diseases with effective and safe \nmedicines that are quality-assured, used in a responsible \nway, and accessible to all who need them. It is expected \nthat countries will develop their own national action plans \non antimicrobial resistance in line with the global plan.\n5. \n \nTo achieve this goal, the global action plan sets out \nfive strategic objectives: (1)\xa0to improve awareness and \nunderstanding of antimicrobial resistance; (2)\xa0to strengthen \nknowledge through surveillance and research; (3)\xa0to \nreduce the incidence of infection; (4)\xa0to optimize the use \nof antimicrobial agents; and (5)\xa0to ensure sustainable \ninvestment in countering antimicrobial resistance. These \nobjectives can be attained through the implementation of \nclearly identified actions by Member States, the Secretariat, \nand international and national partners across multiple'
 'the actions proposed in this plan are equally applicable \nto antifungal resistance in addition to resistance in those \nother microorganisms.\n10. \n \nAntimicrobial resistance (and particularly antibiotic \nresistance) is spreading, and there are few prospects for \nthe development of new classes of antibiotics in the short \nterm.\xa0However, there is today considerable awareness of \nthe need for, and political support for, action to combat \nantimicrobial resistance.\xa0Support is multisectoral, and there \nis increasing collaboration among the relevant sectors, \nin particular, human health, animal health and agriculture \n(including a tripartite collaboration agreed by FAO, OIE and \nWHO3).\xa0The need for urgent action is consistent with a \nprecautionary approach,4 and national and international \nmultisectoral action and collaboration should not be \nimpeded by gaps in knowledge.\n11. \n \nThis global action plan provides the framework for national \naction plans to combat antimicrobial resistance. It sets \nout the key actions that the various actors involved should \ntake, using an incremental approach over the next 5-10 \nyears to combat antimicrobial resistance. These actions \nare structured around the five strategic objectives set out \nin paragraphs 29–47.\nScope\n2 World Health Organization global strategy for the surveillance and monitoring \nof HIV drug resistance. Geneva: World Health Organization; 2012. Guidelines for'
 '` to optimize the use of antimicrobial medicines in human and animal health; \nto develop the economic case for sustainable investment that takes account of the needs of all countries and to \nincrease investment in new medicines, diagnostic tools, vaccines and other interventions.\nThis action plan underscores the need for an effective “one health” approach involving coordination among numerous \ninternational sectors and actors, including human and veterinary medicine, agriculture, finance, environment, and well-\ninformed consumers. The action plan recognizes and addresses both the variable resources nations have to combat \nantimicrobial resistance and the economic factors that discourage the development of replacement products by the \npharmaceutical industry. \nAn all-out effort is needed. WHO will work with the United Nations to tackle antimicrobial resistance at the political \nlevel. Our strong collaboration with FAO and OIE will continue. A framework for monitoring and evaluating national \nactivities is being developed. The objective is to have multisectoral national action plans in place by the 2017 World \nHealth Assembly. \nAntimicrobial resistance is a crisis that must be managed with the utmost urgency. As the world enters the ambitious \nnew era of sustainable development, we cannot allow hard-won gains for health to be eroded by the failure of our \nmainstay medicines. \nDr Margaret Chan\nDirector-General\nWorld Health Organization\nForeword'
 '8\n27. \n \nThe overall goal of the action plan is to ensure, for as \nlong as possible, continuity of the ability to treat and \nprevent infectious diseases with effective and safe \nmedicines that are quality-assured, used in a responsible \nway, and accessible to all who need them.\n28. \n \nTo achieve this overall goal, five strategic objectives \nhave been identified. These are set out below with the \ncorresponding actions for Member States, the Secretariat \n(including actions for FAO, OIE and WHO within the tripartite \ncollaboration), and international organizations and other \npartners, in the tables following paragraph 50. It is expected \nthat countries will develop their own national action plans \non antimicrobial resistance in line with the global plan.\nObjective 1: Improve awareness \nand understanding of \nantimicrobial resistance through \neffective communication, \neducation and training\n29. \n \nSteps need to be taken immediately in order to raise \nawareness of antimicrobial resistance and promote \nbehavioural change, through public communication \nprogrammes that target different audiences in human \nhealth, animal health and agricultural practice as well as \nconsumers. Inclusion of the use of antimicrobial agents \nand resistance in school curricula will promote better \nunderstanding and awareness from an early age.\n30. \n \nMaking antimicrobial resistance a core component of \nprofessional education, training, certification, continuing'
 'VII\nAntimicrobial resistance threatens the very core of modern medicine and the sustainability of an effective, global public \nhealth response to the enduring threat from infectious diseases. Effective antimicrobial drugs are prerequisites for \nboth preventive and curative measures, protecting patients from potentially fatal diseases and ensuring that complex \nprocedures, such as surgery and chemotherapy, can be provided at low risk. Yet systematic misuse and overuse of \nthese drugs in human medicine and food production have put every nation at risk. Few replacement products are in the \npipeline. Without harmonized and immediate action on a global scale, the world is heading towards a post-antibiotic \nera in which common infections could once again kill.\nAlert to this crisis, the May 2015 World Health Assembly adopted a global action plan on antimicrobial resistance, \nwhich outlines five objectives:\nto improve awareness and understanding of antimicrobial resistance through effective communication, education \nand training; \n` to strengthen the knowledge and evidence base through surveillance and research; \n` to reduce the incidence of infection through effective sanitation, hygiene and infection prevention measures; \n` to optimize the use of antimicrobial medicines in human and animal health; \nto develop the economic case for sustainable investment that takes account of the needs of all countries and to']"," The global action plan on antimicrobial resistance aims to ensure, for as long as possible, continuity of successful treatment and prevention of infectious diseases with effective and safe medicines that are quality-assured, used in a responsible way, and accessible to all who need them [4]. This goal is achieved through five strategic objectives:
1. Improve awareness and understanding of antimicrobial resistance [29]
2. Strengthen knowledge through surveillance and research [not explicitly mentioned in the provided context]
3. Reduce the incidence of infection [not explicitly mentioned in the provided context]
4. Optimize the use of antimicrobial agents [30]
5. Ensure sustainable investment in countering antimicrobial resistance [not explicitly mentioned in the provided context]. These objectives can be attained through the implementation of clearly identified actions by Member States, the Secretariat, and international and national partners across multiple sectors [11].","The WHO global action plan on antimicrobial resistance aims to ensure, for as long as possible, the continuity of successful treatment and prevention of infectious diseases with effective and safe medicines, through improved awareness, surveillance, infection control, and sustainable investment in new tools.",,0.8825051534918797,0.99999999998,1.0
What lifestyle modifications are recommended for managing obesity-related diabetes risk?,"['that promote healthy \ndiet, physical activity \nand weight loss \ncan prevent type\xa02 \ndiabetes in people \n\nat high risk'
 '35\nThe vast majority of the world’s \ndiabetes cases are type\u202f2 (1). Some \nrisk factors for type\u202f2 diabetes – \nsuch as genetics, ethnicity and \nage – are not modifiable. Others, \nsuch as being overweight or \nobese, unhealthy diet, insufficient \nphysical activity and smoking are \nmodifiable through behavioural \nand environmental changes. \nSeveral effective policy options \nare available to facilitate these \nbehavioural changes and create \nsupportive environments for \nhealthy lifestyles. At the individual \nlevel, intensive interventions to \nimprove diet and physical activity \ncan prevent or delay the onset \nof type\u202f2 diabetes in people at \nhigh risk.\n2.1\u2002 POPULATION-BASED \nPREVENTION\nThere are strong indications – if \nnot yet direct evidence – that \npopulation-based programmes \naimed at modifiable risk factors can \nreduce the incidence of diabetes \nwhile also lowering blood pressure \nand other cardiovascular risk \nfactors. Population-based data from \nCuba show a fall in type\u202f2 diabetes \nduring a period of economic crisis \nwhen the population experienced \na reduction in calorie intake and a \nsimultaneous increase in physical \nactivity (2), suggesting population-\nwide changes in diet and physical \nactivity do affect type 2 diabetes \nprevalence.\nActions to address overweight and \nobesity are critical to preventing \ntype\u202f2 diabetes. Evidence on \nwhat works as a package of \ninterventions for the prevention \nof overweight and obesity is \nlimited, but much is known about'
 '36\nphysical activity in the population \nwill help reduce the occurrence of \nobesity and type\u202f2 diabetes, and \nwill accrue additional benefits by \nreducing complications among \npeople with all types of diabetes \nand glucose intolerance. WHO’s \nrecommendations for healthy diet \nand physical activity relevant to \ndiabetes are summarized in Box\u202f2.\nPopulation-level interventions to \nreduce tobacco use may contribute \nto prevention of type\u202f2 diabetes, \ngiven emerging evidence of a \nlink between smoking and type\u202f2 \ndiabetes risk. Active tobacco use \nBOX\u202f2.\u2002 HEALTHY DIET AND PHYSICAL ACTIVITY\nAdults can reduce their risk of type\u202f2 diabetes and improve insulin sensitivity and glucose uptake \nthrough regular and adequate levels of physical activity and healthy diets that include sufficient \nconsumption of dietary fibre, and replacing saturated fatty acids with polyunsaturated fatty acids. \nWHO has developed recommendations on healthy diet and physical activity that, if implemented, \ncan reduce an individual’s risk of type\u202f2 diabetes and other NCDs.\nDietary recommendations by WHO and the Food and Agriculture Organization (FAO) for the \nprevention of type\u202f2 diabetes include limiting saturated fatty acid intake to less than 10% of total \nenergy intake (and for high risk groups, less than 7%); and achieving adequate intakes of dietary \nfibre (minimum daily intake of 20 g) through regular consumption of wholegrain cereals, legumes,'
 'Practical perspectives on the management of overweight and obesity.\n\nThe prevalence of obesity, defined as a body mass index of 30 or more, has reached epidemic proportions in the United States. Obesity is associated with an increased risk of multiple conditions, including type 2 diabetes mellitus, cardiovascular disease, arthritis, and sleep apnea. To discuss issues related to obesity in the workplace, healthcare, and managed care settings, stakeholders from these areas participated in a roundtable discussion on several topics, including the management of obesity, managed care coverage policies for obesity treatments, and potential strategies for improving patient outcomes. Participants agreed that obesity is a challenging condition to treat. Lifestyle modification, one of the most commonly recommended treatment modalities, is often inadequate on its own, as patients are unable to maintain weight loss over time. Although lifestyle modification remains important, additional tools are needed. In patients who undergo bariatric surgery, lifestyle modification is also necessary for long-term weight maintenance; however, surgery is not appropriate for all patients. Pharmacologic treatment may also be considered, but cost and managed care coverage policies have the potential to limit patient access to this treatment modality. Increased awareness and additional efforts on the part of all stakeholders are needed to improve outcomes for patients affected by obesity.'
 '69\nPOLICIES RELATED TO PREVENTION\nKey modifiable risk factors for \nthe prevention of type 2 diabetes \nare overweight, obesity, physical \ninactivity and unhealthy diet (see \nBackground section and Part\u202f2). \nMost countries (89%) report \nhaving national policies addressing \nboth healthy diet and physical \nactivity, but when funding and \nimplementation are considered, \nonce again, the picture changes. \nAbout two thirds of countries \n(68%) report having operational \npolicies addressing both healthy \ndiet and physical activity, though \nthis proportion varies by region \nand country income. Thirty-one \nper cent of countries report \nhaving operational policies to \naddress overweight and obesity. \nHigh-income countries were \nmore likely to report having \noperational policies in all of these \nareas than low- or middle-income \ncountries, but it is worth noting \nthat (encouragingly) the majority \nof low-income countries have \noperational policies to address diet \nand physical activity (see Figure\u202f8).\n4.2 NATIONAL GUIDELINES AND \nPROTOCOLS\nNational, evidence-based guidelines, \nprotocols and standards for the \nmanagement of diabetes are \nimportant tools for improving \ncare. Overall, 71% of countries \nNote: policies include those that aim to reduce unhealthy diet and/or promote healthy diet, and those that aim to reduce physical \ninactivity and/or promote physical activity.\nFIGURE\u202f8.\u2002 PERCENTAGE OF COUNTRIES REPORTING OPERATIONAL POLICIES FOR SELECTED RISK FACTORS, BY WHO REGION']"," Les modifications de style de vie recommandées pour gérer le risque de diabète lié à l'obésité comprennent :
- une pratique régulière et adéquate de l'activité physique [2.1]
- une alimentation saine qui comprend suffisamment de fibres alimentaires, et remplace les acides gras saturés par des acides gras polyinsaturés [2]
Les recommandations de WHO pour une alimentation saine et un niveau adéquat d'activité physique peuvent réduire le risque individuel de diabète type 2 et améliorer la sensibilité à l'insuline et l'absorption du glucose [2].","Recommended lifestyle modifications include weight loss, dietary changes, increased physical activity, and smoking cessation counselling for people at risk of developing type 2 diabetes.",1.0,,0.99999999998,0.75
What recommendation does WHO give regarding combination therapy for hypertension?,"['Strong recommendation, high-certainty evidence\n5. RECOMMENDATION ON COMBINATION THERAPY\nFor adults with hypertension requiring pharmacological treatment, WHO suggests \ncombination therapy, preferably with a single-pill combination (to improve adherence and \npersistence), as an initial treatment. Antihypertensive medications used in combination \ntherapy should be chosen from the following three drug classes: diuretics (thiazide or \nthiazide-like), angiotensin-converting enzyme inhibitors (ACEis)/angiotensin-receptor \nblockers (ARBs), and long-acting dihydropyridine calcium channel blockers (CCBs).\n6. RECOMMENDATIONS ON TARGET BLOOD PRESSURE\nWHO recommends a target blood pressure treatment goal of <140/90 mmHg in all patients \nwith hypertension without comorbidities.\nviii'
 'to-decision frameworks of PICO questions 6, 7 and 8 (see Annex 4) were used to develop one \nrecommendation. \n5. RECOMMENDATION ON COMBINATION THERAPY\nFor adults with hypertension requiring pharmacological treatment, WHO suggests \ncombination therapy, preferably with a single-pill combination (to improve adherence and \npersistence), as an initial treatment. Antihypertensive medications used in combination \ntherapy should be chosen from the following three drug classes: diuretics (thiazide or \nthiazide-like), angiotensin-converting enzyme inhibitors (ACEis)/angiotensin-receptor \nblockers (ARBs), and long-acting dihydropyridine calcium channel blockers (CCBs).\nCombination medication therapy may be especially valuable when the baseline BP is \n≥20/10 mmHg higher than the target blood pressure.\nSingle-pill combination therapy improves medication-taking adherence and persistence and BP'
 'WHO suggests pharmacological antihypertensive treatment of individuals without \ncardiovascular disease but with high cardiovascular risk, diabetes mellitus, or chronic kidney \ndisease, and systolic blood pressure of 130–139 mmHg.\nConditional recommendation, moderate- to high-certainty evidence \n2. RECOMMENDATION ON LABORATORY TESTING\nWhen starting pharmacological therapy for hypertension, WHO suggests obtaining tests to \nscreen for comorbidities and secondary hypertension, but only when testing does not delay \nor impede starting treatment.\n3. RECOMMENDATION ON CARDIOVASCULAR DISEASE RISK ASSESSMENT \nWHO suggests cardiovascular disease risk assessment at or after the initiation of \npharmacological treatment for hypertension, but only where this is feasible and does not \ndelay treatment.\n4. RECOMMENDATION ON DRUG CLASSES TO BE USED AS FIRST-LINE AGENTS\nFor adults with hypertension requiring pharmacological treatment, WHO recommends the \nuse of drugs from any of the following three classes of pharmacological antihypertensive \nmedications as an initial treatment: \n1. thiazide and thiazide-like agents\n2. angiotensin-converting enzyme inhibitors (ACEis)/angiotensin-receptor blockers (ARBs)\n3. long-acting dihydropyridine calcium channel blockers (CCBs).\nStrong recommendation, high-certainty evidence\n5. RECOMMENDATION ON COMBINATION THERAPY\nFor adults with hypertension requiring pharmacological treatment, WHO suggests'
 'WHO recommends a target systolic blood pressure treatment goal of <130 mmHg in patients \nwith hypertension and known cardiovascular disease (CVD).\nWHO suggests a target systolic blood pressure treatment goal of <130 mmHg in high-risk \npatients with hypertension (those with high CVD risk, diabetes mellitus, chronic kidney \ndisease).\n7. RECOMMENDATIONS ON FREQUENCY OF ASSESSMENT\nWHO suggests a monthly follow up after initiation or a change in antihypertensive \nmedications until patients reach target.\nWHO suggests a follow up every 3–6 months for patients whose blood pressure is under \n8. RECOMMENDATION ON TREATMENT BY NONPHYSICIAN PROFESSIONALS\nWHO suggests that pharmacological treatment of hypertension can be provided by \nnonphysician professionals such as pharmacists and nurses, as long as the following \nconditions are met: proper training, prescribing authority, specific management protocols \nand physician oversight.\nix'
 'The 2021 WHO hypertension guideline aims to provide the most current and relevant evidence-\nbased global public health guidance on the initiation of treatment (with pharmacological agents) for \nhypertension in adults. The recommendations target the general adult, non-pregnant, hypertensive \npopulation. \nAlthough several countries and professional societies have guidelines on the topic of hypertension, \nthese are specific to the population of that particular country or the specific setting or constituency of \nthe professional society. Recent shifts in hypertension management, such as moving away from using \nbeta-blockers as a first-line agent or the increased research and adoption of combination therapies \nand single-pill combinations, are all additional reasons for new guidance. The Guideline for the \npharmacological treatment of hypertension in adults will be the first global guideline in the past two \ndecades on the topic and will have specific relevance to low- and middle-income countries (LMICs). \nThe guideline provides new recommendations on the threshold for the initiation of pharmacological \ntreatment for hypertension, recommendations on intervals for follow up, target blood pressure to be \nachieved for control, and the cadre of health care workers who may initiate treatment. It provides \nthe basis for deciding whether to initiate treatment with monotherapy, dual therapy, or single-pill']"," La recommandation de l'OMS pour la thérapie combinée en cas de hypertension est la suivante : Pour les adultes présentant une hypertension nécessitant un traitement pharmacologique, l'OMS suggère la thérapie combinée, préférablement avec une pilule à plusieurs médicaments (pour améliorer l'adhésion et la persistance), en tant que traitement initial. Les médicaments antihypertensifs utilisés dans cette thérapie combinée doivent être choisis parmi les trois classes de médicaments suivantes : diurétiques (thiazide ou thiazide-like), inhibiteurs de l'enzyme convertissant l'angiotensine (ACEis)/blocateurs des récepteurs angiotensine (ARBs), et blocateurs de canaux calcium à longue durée d'action dihydropyridine (CCBs) [1, 2]. La thérapie médicamenteuse combinée peut être particulièrement précieuse lorsque la pression artérielle initiale est supérieure à 20/10 mmHg au-dessus de la pression artérielle cible.","WHO suggests combination therapy, preferably as a single-pill combination to improve adherence and persistence, as initial treatment for hypertension, particularly when blood pressure is significantly elevated. The combination should draw from diuretics, ACE inhibitors/ARBs, and calcium channel blockers.",,0.9283762454390959,0.99999999998,1.0
What is the target blood pressure for adults with hypertension without comorbidities?,"['3.6 Target blood pressure\n6. RECOMMENDATION ON TARGET BLOOD PRESSURES\nWHO recommends a target blood pressure treatment goal of <140/90 mmHg in all patients \nwith hypertension without comorbidities.\nWHO recommends a target systolic blood pressure treatment goal of <130 mmHg in \npatients with hypertension and known cardiovascular disease (CVD).\nWHO suggests a target systolic blood pressure treatment goal of <130 mmHg in high-risk \npatients with hypertension (those with high CVD risk, diabetes mellitus, chronic kidney \ndisease).\nThe evidence base consisted of five systematic reviews as well as a review of the SPRINT trial (58). \nEvidence profiles were constructed for various BP treatment targets, based on age and comorbidities \n(Web Annex A). \nThe desirable effects of lower target BP (per 1000 treated patients) were: a reduction in mortality \nof 27 (for SBP <120 vs <130–139) and of 7 (for SBP 140/90 vs 150–160/95–105); a reduction in \ncardiovascular mortality of 40 (for SBP <130 vs <130–149) and 6 (for SBP 140/90 vs 150–160/95–105); \nand a reduction in stroke of 17 (for SBP <130 vs <140). The increase in serious adverse events per 1000 \ntreated patients was 20 (for SBP <130 vs <140) and 5 (for SBP 140/90 vs 150–160/95–105). \nSummary results from a systematic review focusing on adults 65 years and older by Murad et al (59). \nsuggests that treatment to a lower BP target in individuals 65 years or older leads to a significant'
 ""Thresholds and Targets for Hypertension Management in Adults With Type 2 Diabetes Should Remain at 130/80\u2009mmHg: What's the Evidence?\n\nHypertension and diabetes are common comorbidities and are both modifiable risk factors for cardiovascular disease and death. Lowering blood pressure reduces target organ damage and prevents cardiovascular disease outcomes. The harmonized Canadian clinical practice guidelines for managing hypertension in people with diabetes provides health-behaviour advice and medical therapy recommendations for a threshold blood pressure of 130/80\u2009mmHg and above and to target blood pressure to below 130/80\u2009mmHg. We have reviewed the studies supporting these recommendations and others, and they appear to be at odds with the guidelines, including those for elderly people and patients with pre-existing cardiovascular disease.""
 'WHO recommends a target systolic blood pressure treatment goal of <130 mmHg in patients \nwith hypertension and known cardiovascular disease (CVD).\nWHO suggests a target systolic blood pressure treatment goal of <130 mmHg in high-risk \npatients with hypertension (those with high CVD risk, diabetes mellitus, chronic kidney \ndisease).\n7. RECOMMENDATIONS ON FREQUENCY OF ASSESSMENT\nWHO suggests a monthly follow up after initiation or a change in antihypertensive \nmedications until patients reach target.\nWHO suggests a follow up every 3–6 months for patients whose blood pressure is under \n8. RECOMMENDATION ON TREATMENT BY NONPHYSICIAN PROFESSIONALS\nWHO suggests that pharmacological treatment of hypertension can be provided by \nnonphysician professionals such as pharmacists and nurses, as long as the following \nconditions are met: proper training, prescribing authority, specific management protocols \nand physician oversight.\nix']", The target blood pressure for adults with hypertension without comorbidities is less than 140/90 mmHg [1].,WHO recommends a target blood pressure below 140/90 mmHg for adults with hypertension who do not have other comorbidities.,1.0,0.9646324500231384,0.9999999999666667,0.5
